Country,Year Enacted,Scope,Length (in Words),Executive Power,Legislative Power,Judicial Independence,Number of Rights,Preamble,nivel_poder_ejecutivo
Cape Verde,1980,0.76,"32,132",5,0.43,1,87,the proclamation of national independence is one of the supreme moments in the history of the cape verdian nation resulting in the revitalization of our people who have undergone the same vicissitudes of fate but who share the persistent hope of creating in these islands proper living conditions for all of our children independence has also allowed cape verde to become a full member of the international community however the affirmation of an independent state was not accompanied by the establishment of a regime characterized by pluralistic democracy but rather the organization of political power was subject to the philosophy and principles of a single party the exercise of power in this framework has demonstrated on a universal scale the necessity of introducing profound changes in the organization of the political and social life of these states new ideas assail the world destroying structures and concepts which seemed solidly established completely changing the course of international political events in cape verde political opening was announced in with the creation of the institutional conditions required for the first presidential and legislative elections within the framework of political competition thus on september the national popular assembly approved constitutional law no iii which in revoking article of the constitution and establishing the principle of pluralism created a new type of political regime conceived as a means to revitalize democratic elections and a transition towards a new model for the organization of the political and social life of the country it also established a different system of government and another form of suffrage in view of imminent elections for a new legislative assembly it was in this context that the first legislative elections took place in january followed by presidential elections in february the participation of the population in these elections demonstrated clearly the countrys option in the direction of change of political regime however the historical context in which by means of a partial revision of the constitution parties were recognized as the principal instruments for the formation of political will in government has led to a pluralistic democracy which continues to function under the rules and principles of the previous regime nevertheless the political and social reality was that the country was in a process of rapid and profound transformation with the population and emerging political forces assuming the values which characterize a democratic state values not yet mirrored in the constitution this constitutional law intends then to provide the country with a useful framework in its text and in its new model the option in favor of a constitution with the basic principles of a pluralistic democracy abandoning other governmental options will provide stability to a country weak in resources and political succession without upheaval assuming the principle of popular sovereignty this constitutional text consecrates a democratic state with a vast list of rights liberties and guarantees to citizens the concept of the dignity of the human being as the absolute value which is supreme over the state itself a system of government with a balance of power between the various national institutions a strong and independent judiciary local authorities whose officeholders shall be elected by the communities to whom they are responsible a public administration at the service of the citizens and conceived as an instrument of development and a system of defense of the constitution characteristic of a pluralistic democracy therefore this constitutional law incorporates the profound political changes at work in the country and fosters institutional conditions for the exercise of power and of citizenship in a climate of liberty peace and justice the basis of all economic social and cultural development in cape verde,1
Central African Rep.,2013,0.57,"9,767",5,0.24,3,48,the central african people proud of their national unity linguistic unity and of their ethnic cultural and religious diversity which contribute to the enrichment of their personality convinced of the urgent necessity to preserve national unity and peace guarantees of economic and social progress conscious that only the persistent work as well as the rigorous and transparent management of public affairs chose and of the environment can assure a harmonious rational and durable development resolved to build a state of law founded on a pluralistic democracy guaranteeing the security of persons and of property the protection of the most weak notably vulnerable persons the minorities and the full exercise of the fundamental freedoms and rights animated by the desire to assure to man his dignity within respect for the principle of quotzo kwe zoquot declared by the founding father of the central african republic barthelemy boganda conscious that tolerance and dialogue constitute the foundation socle of peace and of national unity convinced that universal suffrage is the sole source of the legitimacy of public power firmly opposed to the conquest of power by force and by any form of dictatorship and oppression as well as any act of division and maintenance of hatred convinced that it is essential that the rights of man will be protected by a regime of law convinced of the necessity for political economic and social african integration at the subregional and regional levels desirous to forge ties of amity with all peoples on the basis of the principles of equality of solidarity of reciprocal interests and of mutual respect of national sovereignty as well as of territorial integrity reiterating their will to cooperate in peace and amity with all states to work for the african union in accordance with the constitutive act adopted on july to promote the peaceful regulation of differences between states with respect for justice for equality for freedom and for the sovereignty of peoples reaffirms their adherence to the charter of the organization of the united nations to the universal declaration of the rights of man of december to the international pacts of december concerning economic social and cultural right on the one hand and civil and political rights on the other reaffirms its commitment to the african charter of the rights of man and of peoples of june reaffirms its adherence to all international conventions duly ratified notably those concerning the prohibition of all forms of discrimination with regard to women as well as those concerning the protection of the rights of the child,1
Chad,1996,0.57,"11,768",4,0.38,3,44,chad proclaimed a republic on november acceded to national and international sovereignty on august since that date it has experienced a momentous institutional and political evolution years of dictatorship and of a single party prevented the emergence of any democratic culture and political pluralism the different regimes that have succeeded one another have created and entrenched regionalism tribalism nepotism social inequalities and violations of the rights of man and of the individual and collective fundamental freedoms of which the consequences have been war political violence hatred intolerance and mistrust between different communities that compose the chadian nation this institutional and political crisis that has destabilized chad for more than three decades has only galvanized the determination of the chadian people to achieve the building of one nation of dignity of freedom of peace and of prosperity therefore the sovereign national conference held at ndjaména from january to april having reunited the political parties the associations of civil society the organs of the state the traditional and religious authorities the representatives of the rural world and the resources of persons of stature personalités have restored confidence within the chadian people and enabled the opening of a new era consequently we the chadian peopleaffirm by this constitution our desire to live together with respect for ethnic religious regional and cultural diversities to build a state of law and one united nation founded on public freedoms and the fundamental rights of man the dignity of the human person and political pluralism on the african values of solidarity and fraternityreaffirm our commitment to the principles of the rights of man as defined by the charter of the united nations of the universal declaration of the rights of man of and the african charter of the rights of man and of peoples of solemnly proclaim our right and our duty to resist and disobey any individual or group of individuals and any organs of the state that would take power by force or exercise it in violation of this constitution affirm our total opposition to any regime of which the policy would be founded on arbitrariness dictatorship injustice corruption extortion nepotism clanism tribalism confessionalism and the confiscation of power affirm our determination to cooperate in peace and amity with all peoples who share our ideals of freedom of justice and of solidarity based on the principles of equality of reciprocal interests of mutual respect and of national sovereignty of territorial integrity and of noninterference proclaim our commitment to the cause of african unity and our commitment to do everything possible to realize subregional and regional integration solemnly adopt this constitution as supreme law of the state this is made an integral part of the constitution,0
Chile,1980,0.67,"25,821",6,0.33,4,46,we the people of chile responsible for her history and future have drafted this political constitution of the republic of chile we have done so in a free and democratic way exercising the original constituent power that we possess the goal of this solemn act is to live in peace justice and prosperity within our borders and to coexist with all countries and peoples of the world promoting and respecting the dignity liberty equality solidarity and the fundamental rights of all human beings,1
China,1982,0.51,"10,960",2,0.38,2,33,china is one of the countries with the longest histories in the world the people of all nationalities in china have jointly created a splendid culture and have a glorious revolutionary tradition feudal china was gradually reduced after to a semicolonial and semifeudal country the chinese people waged wave upon wave of heroic struggles for national independence and liberation and for democracy and freedom great and earthshaking historical changes have taken place in china in the th century the revolution of led by dr sun yatsen abolished the feudal monarchy and gave birth to the republic of china but the chinese people had yet to fulfill their historical task of overthrowing imperialism and feudalism after waging hard protracted and tortuous struggles armed and otherwise the chinese people of all nationalities led by the communist party of china with chairman mao zedong as its leader ultimately in overthrew the rule of imperialism feudalism and bureaucratic capitalism won the great victory of the newdemocratic revolution and founded the peoples republic of china thereupon the chinese people took state power into their own hands and became masters of the country after the founding of the peoples republic the transition of chinese society from a newdemocratic to a socialist society was effected step by step the socialist transformation of the private ownership of the means of production was completed the system of exploitation of man by man eliminated and the socialist system established the peoples democratic dictatorship led by the working class and based on the alliance of workers and peasants which is in essence the dictatorship of the proletariat has been consolidated and developed the chinese people and the chinese peoples liberation army have thwarted aggression sabotage and armed provocations by imperialists and hegemonists safeguarded chinas national independence and security and strengthened its national defense major successes have been achieved in economic development an independent and fairly comprehensive socialist system of industry has in the main been established there has been a marked increase in agricultural production significant progress has been made in educational scientific cultural and other undertakings and socialist ideological education has yielded noteworthy results the living standards of the people have improved considerably both the victory of chinas newdemocratic revolution and the successes of its socialist cause have been achieved by the chinese people of all nationalities under the leadership of the communist party of china and the guidance of marxismleninism and mao zedong thought and by upholding truth correcting errors and overcoming numerous difficulties and hardships china will stay in the primary stage of socialism for a long period of time the basic task of the nation is to concentrate its efforts on socialist modernization along the road of chinesestyle socialism under the leadership of the communist party of china and the guidance of marxismleninism mao zedong thought deng xiaoping theory and the important theory of quotthree representsquot the chinese people of all nationalities will continue to adhere to the peoples democratic dictatorship follow the socialist road persist in reform and openingup steadily improve socialist institutions develop a socialist market economy advance socialist democracy improve the socialist legal system and work hard and selfreliantly to modernize industry agriculture national defense and science and technology step by step promote the coordinated development of the material political and spiritual civilizations to turn china into a powerful and prosperous socialist country with a high level of culture and democracy the exploiting classes as such have been eliminated in our country however class struggle will continue to exist within certain limits for a long time to come the chinese people must fight against those forces and elements both at home and abroad that are hostile to chinas socialist system and try to undermine it taiwan is part of the sacred territory of the peoples republic of china it is the lofty duty of the entire chinese people including our compatriots in taiwan to accomplish the great task of reunifying the motherland in building socialism it is imperative to rely on the workers peasants and intellectuals and unite with all the forces that can be united in the long years of revolution and construction there has been formed under the leadership of the communist party of china a broad patriotic united front that is composed of democratic parties and peoples organizations and embraces all socialist working people all builders of socialism all patriots who support socialism and all patriots who stand for reunification of the motherland as amended by the fourth constitutional amending law of march this united front will continue to be consolidated and developed the chinese peoples political consultative conference is a broadly representative organization of the united front which has played a significant historical role and will continue to do so in the political and social life of the country in promoting friendship with the people of other countries and in the struggle for socialist modernization and for the reunification and unity of the country the system of multiparty cooperation and political consultation led by the communist party of china will exist and develop in china for a long time to come the peoples republic of china is a unitary multinational state built up jointly by the people of all its nationalities socialist relations of equality unity and mutual assistance have been established among them and will continue to be strengthened in the struggle to safeguard the unity of the nationalities it is necessary to combat bignation chauvinism mainly han chauvinism and also necessary to combat localnational chauvinism the state does its utmost to promote the common prosperity of all nationalities in the country chinas achievements in revolution and construction are inseparable from support by the people of the world the future of china is closely linked with that of the whole world china adheres to an independent foreign policy as well as to the five principles of mutual respect for sovereignty and territorial integrity mutual nonaggression noninterference in each others internal affairs equality and mutual benefit and peaceful coexistence in developing diplomatic relations and economic and cultural exchanges with other countries china consistently opposes imperialism hegemonism and colonialism works to strengthen unity with the people of other countries supports the oppressed nations and the developing countries in their just struggle to win and preserve national independence and develop their national economies and strives to safeguard world peace and promote the cause of human progress this constitution affirms the achievements of the struggles of the chinese people of all nationalities and defines the basic system and basic tasks of the state in legal form it is the fundamental law of the state and has supreme legal authority the people of all nationalities all state organs the armed forces all political parties and public organizations and all enterprises and undertakings in the country must take the constitution as the basic norm of conduct and they have the duty to uphold the dignity of the constitution and ensure its implementation,0
Colombia,1991,0.76,"46,902",5,0.33,3,76,the people of colombia in the exercise of their sovereign power represented by their delegates to the national constituent assembly invoking the protection of god and in order to strengthen the unity of the nation and ensure to its members life peaceful coexistence work justice equality understanding freedom and peace within a legal democratic and participatory framework that may guarantee a just political economic and social order and committed to promote the integration of the latin american community decree authorize and promulgate the following,1
Comoros,2001,0.44,"6,185",5,0.24,1,23,the comorian people solemnly affirm their willto draw from islam the religion of the state the permanent inspiration of the principles and rules that govern the unionto guarantee the pursuit of a common destiny of the comorians to give themselves new institutions which are founded on the rule of law and democracy respect the principles of good governance and guarantee a powersharing between the union and the islands which are its members in order to allow them to realize their legitimate aspirations to administer and manage freely without obstacles their own affairs and to promote their socioeconomic development to emphasize their commitment to the principles and fundamental rights defined by the charter of the united nations by the charter of the organization of african unity by the pact of the league of arab states by the universal declaration of human rights and by the african charter on human and peoples rights as well as by the international conventions particularly those relating to childrens and womens rights they proclaimthe solidarity between the union and the islands and among the islands themselvesthe equality of the islands concerning rights and duties the equality of all concerning rights and duties without distinctions based on sex origin race religion or belief the equality of all before the courts and the right of anyone who is subject to the jurisdiction of the courts to defend himself the freedom and security of each individual under the sole condition that he does not commit any act likely to harm others the right to obtain information from a variety of sources and to freedom of the press freedom of expression and of assembly freedom of association and freedom to organize trade unions subject to respect for morals and public order freedom of enterprise as well as the safety of capital and investments the inviolability of the domicile in the conditions defined by law the right to strike within the framework of the laws which regulate it the guarantee of property rights save in cases of public utility or necessity determined in accordance with the law and subject to just compensation the right to health and education for all the right of the child and of the youth to be protected by the public authorities against any form of abandonment exploitation and violence the right to an intact environment and the duty of all to preserve that environment this shall be considered an integral part of the constitution,1
Congo,2001,0.6,"9,970",6,0.29,2,55,the morning after the accession of the congo to the dignity of a sovereign and independent state a decisive turning point had been taken notably by the crystallization of the collective hope in the becoming of the nation the experiences lived through the different political regimes that have succeeded one another as well as those of other peoples have led the congolese people to make the choice of pluralist democracy as the base of the values having to orient the development of the country to stimulate its moral cultural and material development and to respond to the collective demand for a social betterbeing also concerned to work for the enrichment of the universal patrimony common to all the democratic societies around the world and founding ourselves on the sociocultural values particular to our country we the congolese people proclaim our firm willingness to construct a state of law and a fraternal and solidary nation condemn the coup détat the tyrannical exercise of power and the use of political violence under all its forms as a means of ascension to power or to its conservation adhere to the universal values of peace of freedom of equality of justice of tolerance of probity and to the virtues of dialogue as cardinal references of the new political culture reaffirm the sacred character of the human life the right to property and the right to diversity reaffirm solemnly our permanent right of inalienable sovereignty concerning all our wealth and our natural resources as fundamental elements of our development declare as an integral part of this constitution the fundamental principles proclaimed and guaranteed bythe united nations charter of october the universal declaration of the rights of man of december the african charter of the rights of man and of peoples of june all the pertinent international texts duly ratified relative to human rights the charter of the national unity and the charter of the rights and the freedoms adopted by the sovereign national conference on may ordain and establish for the congo this constitution that enunciates the fundamental principles of the republic defines the rights and the duties of the citizens and establishes the forms of organization and the rules of functioning of the state,1
"Congo, Dem. Rep.",2005,0.7,"19,285",5,0.38,1,58,we the congolese people united by destiny and history encompassing the noble ideas of liberty of fraternity of solidarity of justice of peace and of work animated by our common will to build in the heart of africa a state of law and a powerful and prosperous nation founded on a real political economic social and cultural democracy considering that injustice and its corollaries impunity nepotism regionalism tribalism clanism and patronage by their multiple vicissitudes are at the origin of the general decline of values and of the ruin of the country affirming our determination to protect and to consolidate the national independence and unity with respect for our diversities and for our positive particularities reaffirming our adherence and our attachment to the conventions of the united nations on the rights of the child and on the rights of women particularly to the objective of the parity of manwoman representation within the institutions of the country as well as to the international instruments concerning the protection and promotion of human rights moved by the will to see all the african states united and working in concert with a view of promoting and of consolidating african unity through the continental regional or subregional organizations to offer better perspectives of development and of socioeconomic progress to the peoples of africa attached to the promotion of mutually advantageous international cooperation and to the rapprochement of the peoples of the world with respect to their respective identities and to the principles of sovereignty and of the territorial integrity of each state reaffirming our inalienable and imprescriptible right to organize ourselves freely and to develop our political economic social and cultural life following our own genius conscious of our responsibilities before god the nation africa and the world solemnly declare to adopt this constitution,1
Costa Rica,1949,0.63,"16,705",5,0.29,1,55,we the representatives of the people of costa rica freely elected deputies to the national constituent assembly invoking the name of god and reiterating our faith in democracy decree and sanction the following,1
